subject,question_topic,question,answer,comments,rows,answer_type,place_holder,error_message,image_url,reference_url,reference_time,reference_url2,reference_time2,reference_url3,reference_time3,reference_url4,reference_time4,reference_url5,reference_time5,reference_url6,reference_time6,reference_url7,reference_time7
ReactClassBased,Stateful vs Stateless,"What is a good practice for <b>Stateful</b> and what is a good practice for <b>Stateless</b> components?<br/>
a) The component that manages state, should not be involved with rendering, which means that it should not contain too much jsx: <br><br>

b) The components that render things should not track any state: ","a) The component that manages state, should not be involved with rendering, which means that it should not contain too much jsx: <b>Stateful</b><br/><br/>

b) The components that render things should not track any state: <b>Stateless</b>",,4,text-type,"a) The component that manages state, should not be involved with rendering, which means that it should not contain too much jsx: 

b) The components that render things should not track any state: ",Wrong,,https://www.udemy.com/course/react-the-complete-guide-incl-redux/learn/lecture/8103728,,,,,,,,,,,,,
